{"compatibleDefinitionDigest":"e8b90c81cf8c93ccd173697f96939476e3b3650ed60cd506329cfcfc765167c9","flatSurface":{"chart":"pillowcase-square","cutRadius":0.846,"diskCenters":{"A":[0.5,0.5],"B":[1.5,0.5],"C":[0.5,1.5],"D":[1.5,1.5]},"sideLength":2,"topology":"pillowcase"},"id":"flat-pillowcase-v1","kind":"flat-quotient","requiredCapabilities":["triangle-meshes","rigid-transforms","quotient-surface","quotient-orbifold"],"schemaVersion":1}
