{"compatibleDefinitionDigest":"2fd77b609b156ead214d8c01654f45be664e84b1cff3ace5082db4280b4c2ba4","flatSurface":{"chart":"pillowcase-square","cutRadius":0.6,"diskCenters":{"A":[0.5,0.5],"B":[1.5,0.5],"C":[0.5,1.5],"D":[1.5,1.5],"E":[1.0,1.0],"F":[1.0,0.0]},"sideLength":2,"topology":"pillowcase"},"id":"flat-pillowcase-6-v1","kind":"flat-quotient","requiredCapabilities":["triangle-meshes","rigid-transforms","quotient-surface","quotient-orbifold"],"schemaVersion":1}
