{"compatibleDefinitionDigest":"33e395e1b9c350c49fe2b5a3371e0ea0e0fb2604521ca4aba4672ed33cf18164","controlLayout":{"drivers":{"B":{"angles":[0.0,1.4905416137599223,1.872429252242059,2.920214441177605,3.362970866001981,4.4107560549375275,4.792643693419664]},"D":{"angles":[0.0,1.5657212373592344,1.8115604658998197,4.471624841279766,4.717464069820352]},"F":{"angles":[0.0,1.4905416137599223,2.9810832275198447,3.3021020796597416,4.792643693419664]},"L":{"angles":[0.0,1.4905416137599223,1.872429252242059,2.920214441177605,3.362970866001981,4.4107560549375275,4.792643693419664]},"R":{"angles":[0.0,1.4905416137599223,2.9810832275198447,3.3021020796597416,4.792643693419664]},"U":{"angles":[0.0,1.4905416137599223,1.8115604658998197,2.9810832275198447,3.3021020796597416,4.471624841279766,4.792643693419664]}},"paths":{"B":{"B":1.4905416137599223},"B_a":{"B":0.38188763848213636},"B_a_inv":{"B":-0.38188763848213636},"B_b":{"B":0.4427564248243758},"B_b_inv":{"B":-0.4427564248243758},"B_c":{"B":1.0477851889355465},"B_c_inv":{"B":-1.0477851889355465},"B_d":{"B":1.4296728274176829},"B_d_inv":{"B":-1.4296728274176829},"B_e":{"B":1.8724292522420587},"B_e_inv":{"B":-1.8724292522420587},"B_f":{"B":2.538326802695469},"B_f_inv":{"B":-2.538326802695469},"B_g":{"B":2.920214441177605},"B_g_inv":{"B":-2.920214441177605},"B_h":{"B":2.9810832275198447},"B_h_inv":{"B":-2.9810832275198447},"B_inv":{"B":-1.4905416137599223},"D":{"D":1.5657212373592344},"D_a":{"D":0.24583922854058526},"D_a_inv":{"D":-0.24583922854058526},"D_b":{"D":1.8115604658998201},"D_b_inv":{"D":-1.8115604658998201},"D_c":{"D":2.660064375379946},"D_c_inv":{"D":-2.6600643753799464},"D_d":{"D":2.9059036039205317},"D_d_inv":{"D":-2.9059036039205317},"D_e":{"D":3.131442474718469},"D_e_inv":{"D":-3.131442474718469},"D_inv":{"D":-1.5657212373592344},"F":{"F":1.4905416137599223},"F_a":{"F":0.3210188521398969},"F_a_inv":{"F":-0.3210188521398969},"F_b":{"F":1.8115604658998192},"F_b_inv":{"F":-1.8115604658998192},"F_c":{"F":2.9810832275198447},"F_c_inv":{"F":-2.9810832275198447},"F_inv":{"F":-1.4905416137599223},"L":{"L":1.4905416137599223},"L_a":{"L":0.38188763848213636},"L_a_inv":{"L":-0.38188763848213636},"L_b":{"L":0.4427564248243758},"L_b_inv":{"L":-0.4427564248243758},"L_c":{"L":1.0477851889355465},"L_c_inv":{"L":-1.0477851889355465},"L_d":{"L":1.4296728274176829},"L_d_inv":{"L":-1.4296728274176829},"L_e":{"L":1.8724292522420587},"L_e_inv":{"L":-1.8724292522420587},"L_f":{"L":2.538326802695469},"L_f_inv":{"L":-2.538326802695469},"L_g":{"L":2.920214441177605},"L_g_inv":{"L":-2.920214441177605},"L_h":{"L":2.9810832275198447},"L_h_inv":{"L":-2.9810832275198447},"L_inv":{"L":-1.4905416137599223},"R":{"R":1.4905416137599223},"R_a":{"R":0.3210188521398969},"R_a_inv":{"R":-0.3210188521398969},"R_b":{"R":1.8115604658998192},"R_b_inv":{"R":-1.8115604658998192},"R_c":{"R":2.9810832275198447},"R_c_inv":{"R":-2.9810832275198447},"R_inv":{"R":-1.4905416137599223},"U":{"U":1.4905416137599223},"U_a":{"U":0.32101885213989734},"U_a_inv":{"U":-0.32101885213989734},"U_b":{"U":1.1695227616200246},"U_b_inv":{"U":-1.169522761620025},"U_c":{"U":1.8115604658998201},"U_c_inv":{"U":-1.8115604658998201},"U_d":{"U":2.660064375379946},"U_d_inv":{"U":-2.6600643753799464},"U_e":{"U":2.9810832275198447},"U_e_inv":{"U":-2.9810832275198447},"U_inv":{"U":-1.4905416137599223}},"version":1},"id":"melty-c-spherical-v1","kind":"articulated-spherical","motionFamilies":{"families":{"B":{"axis":[0.11632629236816851,0.04268709233795961,-0.9922933063623912],"coordinates":{"0":-0.0,"1":-1.4905416137599223,"2":-1.872429252242059,"3":-2.920214441177605,"4":-3.362970866001981,"5":-4.4107560549375275,"6":-4.792643693419664},"pivot":[0,0,0],"space":"world"},"D":{"axis":[-0.1471609700617641,-0.9781039299486334,-0.1471609700617641],"coordinates":{"0":-0.0,"1":-1.5657212373592344,"2":-1.8115604658998197,"3":-4.471624841279766,"4":-4.717464069820352},"pivot":[0,0,0],"space":"world"},"F":{"axis":[0.03418593501774457,0.13962066595018258,0.9896147692342663],"coordinates":{"0":-0.0,"1":-1.4905416137599223,"2":-2.9810832275198447,"3":-3.3021020796597416,"4":-4.792643693419664},"pivot":[0,0,0],"space":"world"},"L":{"axis":[-0.992293306362391,0.04268709233795962,0.11632629236816845],"coordinates":{"0":-0.0,"1":-1.4905416137599223,"2":-1.872429252242059,"3":-2.920214441177605,"4":-3.362970866001981,"5":-4.4107560549375275,"6":-4.792643693419664},"pivot":[0,0,0],"space":"world"},"R":{"axis":[0.9896147692342662,0.13962066595018255,0.03418593501774446],"coordinates":{"0":-0.0,"1":-1.4905416137599223,"2":-2.9810832275198447,"3":-3.3021020796597416,"4":-4.792643693419664},"pivot":[0,0,0],"space":"world"},"U":{"axis":[-0.050891587044798264,0.9974066837234065,-0.050891587044798264],"coordinates":{"0":-0.0,"1":-1.4905416137599223,"2":-1.8115604658998197,"3":-2.9810832275198447,"4":-3.3021020796597416,"5":-4.471624841279766,"6":-4.792643693419664},"pivot":[0,0,0],"space":"world"}},"version":1},"radius":2.05,"requiredCapabilities":["triangle-meshes","rigid-transforms","shared-rotation-tracks","family-rotation-generators","transport-path-selectors"],"rotationTracks":{"B":{"family":"B","from":"0","to":"1","winding":0},"B_a":{"family":"B","from":"1","to":"2","winding":0},"B_a_inv":{"family":"B","from":"2","to":"1","winding":0},"B_b":{"family":"B","from":"3","to":"4","winding":0},"B_b_inv":{"family":"B","from":"4","to":"3","winding":0},"B_c":{"family":"B","from":"2","to":"3","winding":0},"B_c_inv":{"family":"B","from":"3","to":"2","winding":0},"B_d":{"family":"B","from":"1","to":"3","winding":0},"B_d_inv":{"family":"B","from":"3","to":"1","winding":0},"B_e":{"family":"B","from":"0","to":"2","winding":0},"B_e_inv":{"family":"B","from":"0","to":"5","winding":1},"B_f":{"family":"B","from":"2","to":"5","winding":0},"B_f_inv":{"family":"B","from":"5","to":"2","winding":0},"B_g":{"family":"B","from":"0","to":"3","winding":0},"B_g_inv":{"family":"B","from":"0","to":"4","winding":1},"B_h":{"family":"B","from":"6","to":"1","winding":-1},"B_h_inv":{"family":"B","from":"1","to":"6","winding":1},"B_inv":{"family":"B","from":"0","to":"6","winding":1},"D":{"family":"D","from":"0","to":"1","winding":0},"D_a":{"family":"D","from":"1","to":"2","winding":0},"D_a_inv":{"family":"D","from":"2","to":"1","winding":0},"D_b":{"family":"D","from":"0","to":"2","winding":0},"D_b_inv":{"family":"D","from":"0","to":"3","winding":1},"D_c":{"family":"D","from":"2","to":"3","winding":0},"D_c_inv":{"family":"D","from":"3","to":"2","winding":0},"D_d":{"family":"D","from":"1","to":"3","winding":0},"D_d_inv":{"family":"D","from":"3","to":"1","winding":0},"D_e":{"family":"D","from":"4","to":"1","winding":-1},"D_e_inv":{"family":"D","from":"1","to":"4","winding":1},"D_inv":{"family":"D","from":"0","to":"4","winding":1},"F":{"family":"F","from":"0","to":"1","winding":0},"F_a":{"family":"F","from":"2","to":"3","winding":0},"F_a_inv":{"family":"F","from":"3","to":"2","winding":0},"F_b":{"family":"F","from":"1","to":"3","winding":0},"F_b_inv":{"family":"F","from":"3","to":"1","winding":0},"F_c":{"family":"F","from":"0","to":"2","winding":0},"F_c_inv":{"family":"F","from":"0","to":"3","winding":1},"F_inv":{"family":"F","from":"0","to":"4","winding":1},"L":{"family":"L","from":"0","to":"1","winding":0},"L_a":{"family":"L","from":"1","to":"2","winding":0},"L_a_inv":{"family":"L","from":"2","to":"1","winding":0},"L_b":{"family":"L","from":"3","to":"4","winding":0},"L_b_inv":{"family":"L","from":"4","to":"3","winding":0},"L_c":{"family":"L","from":"2","to":"3","winding":0},"L_c_inv":{"family":"L","from":"3","to":"2","winding":0},"L_d":{"family":"L","from":"1","to":"3","winding":0},"L_d_inv":{"family":"L","from":"3","to":"1","winding":0},"L_e":{"family":"L","from":"0","to":"2","winding":0},"L_e_inv":{"family":"L","from":"0","to":"5","winding":1},"L_f":{"family":"L","from":"2","to":"5","winding":0},"L_f_inv":{"family":"L","from":"5","to":"2","winding":0},"L_g":{"family":"L","from":"0","to":"3","winding":0},"L_g_inv":{"family":"L","from":"0","to":"4","winding":1},"L_h":{"family":"L","from":"6","to":"1","winding":-1},"L_h_inv":{"family":"L","from":"1","to":"6","winding":1},"L_inv":{"family":"L","from":"0","to":"6","winding":1},"R":{"family":"R","from":"0","to":"1","winding":0},"R_a":{"family":"R","from":"2","to":"3","winding":0},"R_a_inv":{"family":"R","from":"3","to":"2","winding":0},"R_b":{"family":"R","from":"1","to":"3","winding":0},"R_b_inv":{"family":"R","from":"3","to":"1","winding":0},"R_c":{"family":"R","from":"0","to":"2","winding":0},"R_c_inv":{"family":"R","from":"0","to":"3","winding":1},"R_inv":{"family":"R","from":"0","to":"4","winding":1},"U":{"family":"U","from":"0","to":"1","winding":0},"U_a":{"family":"U","from":"1","to":"2","winding":0},"U_a_inv":{"family":"U","from":"2","to":"1","winding":0},"U_b":{"family":"U","from":"2","to":"3","winding":0},"U_b_inv":{"family":"U","from":"3","to":"2","winding":0},"U_c":{"family":"U","from":"0","to":"2","winding":0},"U_c_inv":{"family":"U","from":"0","to":"5","winding":1},"U_d":{"family":"U","from":"2","to":"5","winding":0},"U_d_inv":{"family":"U","from":"5","to":"2","winding":0},"U_e":{"family":"U","from":"0","to":"3","winding":0},"U_e_inv":{"family":"U","from":"0","to":"4","winding":1},"U_inv":{"family":"U","from":"0","to":"6","winding":1}},"schemaVersion":1}
