{
  "angularSegments": 64,
  "compatibleDefinitionDigest": "5f789c7670db01a2a0cb1b62293de73d867a4efbbdaca54d3cc77df828e13c75",
  "diskAngleDegrees": 70,
  "fidelity": "spherical-surface-model",
  "id": "bandaged-cube-spherical-v1",
  "kind": "cube-spherical",
  "portInset": 0.04,
  "radialSegments": 5,
  "radius": 2.05,
  "requiredCapabilities": [
    "triangle-meshes",
    "rigid-transforms"
  ],
  "schemaVersion": 1,
  "surfaceLift": 0.02
}
