{"compatibleDefinitionDigest":"3e7e466ed5fca731e4cfab9677a30ae02033d54145f1ae19bba8f6c8b6d043c5","id":"bagua-spherical-v1","kind":"polyhedral-spherical","operationTracks":{"B":{"axis":[0,0,-1],"fromStop":0,"toStop":2},"B+":{"axis":[0,0,-1],"fromStop":0,"toStop":1},"B-":{"axis":[0,0,-1],"fromStop":0,"toStop":7},"B_half":{"axis":[0,0,-1],"fromStop":0,"toStop":4},"B_inv":{"axis":[0,0,-1],"fromStop":0,"toStop":6},"D":{"axis":[0,-1,0],"fromStop":0,"toStop":2},"D+":{"axis":[0,-1,0],"fromStop":0,"toStop":1},"D-":{"axis":[0,-1,0],"fromStop":0,"toStop":7},"D_half":{"axis":[0,-1,0],"fromStop":0,"toStop":4},"D_inv":{"axis":[0,-1,0],"fromStop":0,"toStop":6},"F":{"axis":[0,0,1],"fromStop":0,"toStop":2},"F+":{"axis":[0,0,1],"fromStop":0,"toStop":1},"F-":{"axis":[0,0,1],"fromStop":0,"toStop":7},"F_half":{"axis":[0,0,1],"fromStop":0,"toStop":4},"F_inv":{"axis":[0,0,1],"fromStop":0,"toStop":6},"L":{"axis":[-1,0,0],"fromStop":0,"toStop":2},"L+":{"axis":[-1,0,0],"fromStop":0,"toStop":1},"L-":{"axis":[-1,0,0],"fromStop":0,"toStop":7},"L_half":{"axis":[-1,0,0],"fromStop":0,"toStop":4},"L_inv":{"axis":[-1,0,0],"fromStop":0,"toStop":6},"R":{"axis":[1,0,0],"fromStop":0,"toStop":2},"R+":{"axis":[1,0,0],"fromStop":0,"toStop":1},"R-":{"axis":[1,0,0],"fromStop":0,"toStop":7},"R_half":{"axis":[1,0,0],"fromStop":0,"toStop":4},"R_inv":{"axis":[1,0,0],"fromStop":0,"toStop":6},"U":{"axis":[0,1,0],"fromStop":0,"toStop":2},"U+":{"axis":[0,1,0],"fromStop":0,"toStop":1},"U-":{"axis":[0,1,0],"fromStop":0,"toStop":7},"U_half":{"axis":[0,1,0],"fromStop":0,"toStop":4},"U_inv":{"axis":[0,1,0],"fromStop":0,"toStop":6}},"radius":2.05,"requiredCapabilities":["triangle-meshes","rigid-transforms"],"schemaVersion":1}
