{"compatibleDefinitionDigest":"930fb53595b1fac570d73e6f02222a4927da4f0f607fab36059eb4bcc5519a1f","flatSurface":{"chart":"orbifold-333-rhombus","cutRadius":0.36,"diskCenters":{"A":[0.0,0.0],"B":[1.0,0.0],"C":[0.5,0.8660254037844387],"D":[0.5,0.0],"E":[0.75,0.43301270189221935],"F":[0.25,0.43301270189221935]},"sideLength":1,"topology":"orbifold-333"},"id":"flat-333-6-v1","kind":"flat-quotient","requiredCapabilities":["triangle-meshes","rigid-transforms","quotient-surface","quotient-orbifold"],"schemaVersion":1}
